{
  "schema": "the-interdependency.repository-plan-report",
  "version": "1.0.0",
  "repository": "The-Interdependency/epac",
  "contract": {
    "repository": "The-Interdependency/skill-lib",
    "path": "interdependent-work-graph/repository-plan-report.schema.json",
    "version": "1.0.0",
    "blob_sha": "9b347b2dff7692054b571602f30ee6d00c2e7265"
  },
  "source": {
    "branch": "graduate/package-release-20260912",
    "commit": "c495f316a0a4b93a0f1ccbdc48bb2996e7c610ff",
    "generated_at": "2026-09-12",
    "note": "Describes the preceding implementation commit. The latest repairs pass 14 visualization tests and 12 inventory/closure tests, with 195 tests collected. Descriptor sufficiency remains FALSIFIED while independently checked compositionality remains SURVIVED. Missing/invalid closure status stays unresolved or blocked. The full private artifact matrix and exact review of the repaired head are pending; owner-selected licensing and stable graduation remain open."
  },
  "authority": {
    "owns": [
      "independent extracted EPAC research repository state and repository-local executable candidate constructions",
      "preservation of EPAC provenance, preregistered comparisons, and their scoped epistemic status",
      "future EPAC implementation/public-contract authority once graduation gates are actually completed"
    ],
    "does_not_own": [
      "UCNS geometry authority",
      "stack authority over other projects",
      "external physics or chemistry truth merely from repository independence or executable models"
    ],
    "non_transfer": [
      "repository extraction does not transfer empirical, physics, chemistry, proof, or geometry standing",
      "UCNS geometry use does not transfer external-domain truth",
      "stack-origin research remains provenance and does not itself complete EPAC graduation"
    ]
  },
  "portfolio_role": {
    "summary": "Own the independently extracted EPAC candidate repository while preserving its stack provenance and keeping authority transition incomplete until release/reconsumption graduation gates pass.",
    "reports_to": {
      "repository": "The-Interdependency/skill-lib",
      "skill": "interdependent-work-graph",
      "relation": "repo-owned report consumed by the deterministic portfolio projection"
    }
  },
  "status": {
    "state": "extracted candidate; package preparation implemented; graduation incomplete",
    "current_claim": "The package preserves the 45-file forge continuation and binds accepted UCNS 6eea1828a34ed8ec99879f8090ea5d48352d8c2d. The preceding ff88d3d matrix passed all six private 192-test installations; earlier f311 downloaded artifact evidence independently matched Git. Latest receipt, completeness and closure corrections preserve the scientific boundaries. The latest repairs pass 14 visualization tests and 12 inventory/closure tests, with 195 tests collected. Descriptor sufficiency remains FALSIFIED while independently checked compositionality remains SURVIVED. Missing/invalid closure status stays unresolved or blocked. The full private artifact matrix and exact review of the repaired head are pending; owner-selected licensing and stable graduation remain open."
  },
  "delivered": [
    {
      "surface": "independent EPAC repository extraction",
      "status": "implemented and independently verified",
      "boundary": "repository independence is not completion of authority transition"
    },
    {
      "surface": "molecular comparison evidence",
      "status": "preserved FALSIFIED result for preregistered scope",
      "boundary": "negative result remains scoped; no broader chemistry claim follows"
    },
    {
      "surface": "subatomic and standing-wave candidate constructions",
      "status": "implemented research candidates/witnesses",
      "boundary": "modeling direction is not established external physics merely by execution"
    },
    {
      "surface": "independent package and artifact replay preparation",
      "status": "implemented; final release candidate qualification pending",
      "boundary": "clean installed-code checks and private replay do not pass the unresolved license gate or establish external physics"
    }
  ],
  "active_frontier": [
    "record the owner-selected license and distribution rights",
    "qualify final pinned EPAC artifacts after owner-selected licensing",
    "verify the same candidate in stack before publication, then publish and reconsume those bytes",
    "retire the forge implementation and record the scoped authority-transition receipt after successful reconsumption"
  ],
  "next_actions": [
    {
      "action": "resolve the license gate and qualify the exact final artifact",
      "owner": "The-Interdependency/epac",
      "dependency": "owner-selected license; the accepted exact UCNS source is now bound"
    },
    {
      "action": "verify the candidate in stack before publication",
      "owner": "The-Interdependency/stack",
      "dependency": "same immutable EPAC artifact already tested independently"
    },
    {
      "action": "publish, reconsume, retire the forge path and record the transition",
      "owner": "The-Interdependency/stack",
      "dependency": "verified public artifact identity and completed graduation gates"
    }
  ],
  "blocked": [
    "Stable release qualification requires the owner to select and record the EPAC license."
  ],
  "cross_repository_relations": [
    {
      "repository": "The-Interdependency/skill-lib",
      "relation": "consumer of canonical build/evidence, graduation, and work-graph doctrine",
      "authority_transfer": false
    },
    {
      "repository": "The-Interdependency/stack",
      "relation": "forge of origin; retains incubator research and must later reconsume released EPAC to complete graduation",
      "authority_transfer": false
    },
    {
      "repository": "The-Interdependency/ucns",
      "relation": "pinned geometry dependency for EPAC candidate constructions; external-domain status does not transfer",
      "authority_transfer": false
    }
  ],
  "machine_entrypoints": {
    "repo_report": "docs/work-graphs/repository-plan-report.json",
    "system_overview": "README.md",
    "tests": "tests/",
    "subatomic": "subatomic/",
    "provenance": "docs/",
    "ci": ".github/workflows/ci.yml",
    "package": "pyproject.toml",
    "release_builder": "tools/build_release.py",
    "artifact_replay": "tools/replay_distributions.sh",
    "graduation": "docs/graduation.json",
    "ucns_source_identity": "data/ucns-source-lock.json",
    "subatomic_tests": "tests/subatomic/"
  },
  "hmmm": [
    "owner-selected license/distribution rights remain unresolved",
    "final immutable release candidate and exact pre-publication stack acceptance remain pending",
    "public artifact reconsumption and authority-transition receipt remain incomplete",
    "stronger external-physics standing for standing-wave language remains unresolved"
  ]
}
